{"$defs":{"BinaryWireV1":{"additionalProperties":false,"properties":{"byte_length":{"format":"uint64","minimum":0,"type":"integer"},"data":{"type":"string"},"encoding":{"type":"string"}},"required":["encoding","data","byte_length"],"type":"object"},"CapWireV1":{"additionalProperties":false,"properties":{"kind":{"$ref":"#/$defs/CodeWireV1"},"limit":{"format":"uint64","minimum":0,"type":"integer"},"reached":{"type":"boolean"},"used":{"format":"uint64","minimum":0,"type":"integer"}},"required":["kind","used","limit","reached"],"type":"object"},"CodeWireV1":{"additionalProperties":false,"properties":{"code":{"type":"string"},"other_code":{"format":"uint16","maximum":65535,"minimum":0,"type":["integer","null"]},"version":{"format":"uint16","maximum":65535,"minimum":0,"type":["integer","null"]}},"required":["code"],"type":"object"},"CompletenessWireV1":{"oneOf":[{"additionalProperties":false,"properties":{"proof":{"$ref":"#/$defs/CodeWireV1"},"state":{"const":"complete","type":"string"}},"required":["state","proof"],"type":"object"},{"additionalProperties":false,"properties":{"continuation":{"anyOf":[{"$ref":"#/$defs/BinaryWireV1"},{"type":"null"}]},"reasons":{"items":{"$ref":"#/$defs/CodeWireV1"},"type":"array"},"state":{"const":"partial","type":"string"}},"required":["state","reasons"],"type":"object"},{"additionalProperties":false,"properties":{"reason":{"type":"string"},"state":{"const":"unknown","type":"string"}},"required":["state","reason"],"type":"object"}]},"HighWaterWireV1":{"additionalProperties":false,"properties":{"cursor":{"$ref":"#/$defs/BinaryWireV1"},"member":{"$ref":"#/$defs/BinaryWireV1"}},"required":["member","cursor"],"type":"object"}},"$id":"schemas/evidentrail/v1/fetch_completion.schema.json","$schema":"https://json-schema.org/draft/2020-12/schema","additionalProperties":false,"properties":{"acknowledged_payload_bytes":{"format":"uint64","maximum":9007199254740991,"minimum":0,"type":"integer"},"acknowledged_records":{"format":"uint64","maximum":9007199254740991,"minimum":0,"type":"integer"},"acknowledged_source_bytes":{"format":"uint64","maximum":9007199254740991,"minimum":0,"type":"integer"},"adapter_kind":{"type":"string"},"adapter_outcome":{"type":"string"},"adapter_version":{"type":"string"},"cap_usage":{"items":{"$ref":"#/$defs/CapWireV1"},"maxItems":4096,"type":"array"},"completeness":{"$ref":"#/$defs/CompletenessWireV1"},"contract":{"const":"evidentrail.fetch_completion","type":"string"},"contract_version":{"const":1,"format":"uint16","maximum":9007199254740991,"minimum":0,"type":"integer"},"ended_at_unix_nanos":{"pattern":"^-?(0|[1-9][0-9]*)$","type":"string"},"error_codes":{"items":{"$ref":"#/$defs/CodeWireV1"},"maxItems":4096,"type":"array"},"final_cursor":{"anyOf":[{"$ref":"#/$defs/BinaryWireV1"},{"type":"null"}]},"first_cursor":{"anyOf":[{"$ref":"#/$defs/BinaryWireV1"},{"type":"null"}]},"high_water_marks":{"items":{"$ref":"#/$defs/HighWaterWireV1"},"maxItems":4096,"type":"array"},"members_attempted":{"format":"uint64","maximum":9007199254740991,"minimum":0,"type":"integer"},"members_completed":{"format":"uint64","maximum":9007199254740991,"minimum":0,"type":"integer"},"pages_attempted":{"format":"uint64","maximum":9007199254740991,"minimum":0,"type":"integer"},"pages_completed":{"format":"uint64","maximum":9007199254740991,"minimum":0,"type":"integer"},"plan_digest":{"pattern":"^plan_sha256_[0-9a-f]{64}$","type":"string"},"plan_id":{"pattern":"^plan_[0-9a-f]{64}$","type":"string"},"retrieval_id":{"pattern":"^ret_[0-9a-f]{64}$","type":"string"},"started_at_unix_nanos":{"pattern":"^-?(0|[1-9][0-9]*)$","type":"string"}},"required":["contract","contract_version","retrieval_id","plan_id","plan_digest","adapter_kind","adapter_version","started_at_unix_nanos","ended_at_unix_nanos","acknowledged_records","acknowledged_payload_bytes","acknowledged_source_bytes","members_attempted","members_completed","pages_attempted","pages_completed","high_water_marks","cap_usage","adapter_outcome","error_codes","completeness"],"title":"evidentrail.fetch_completion","type":"object"}