{"acknowledged_payload_bytes":0,"acknowledged_records":0,"acknowledged_source_bytes":0,"adapter_kind":"fixture","adapter_outcome":"finished","adapter_version":"1","cap_usage":[],"completeness":{"proof":{"code":"in_memory_fixture_exhausted","other_code":null,"version":null},"state":"complete"},"contract":"evidentrail.fetch_completion","contract_version":1,"ended_at_unix_nanos":"0","error_codes":[],"final_cursor":null,"first_cursor":null,"high_water_marks":[],"members_attempted":0,"members_completed":0,"pages_attempted":0,"pages_completed":0,"plan_digest":"plan_sha256_0000000000000000000000000000000000000000000000000000000000000000","plan_id":"plan_0000000000000000000000000000000000000000000000000000000000000000","retrieval_id":"ret_0000000000000000000000000000000000000000000000000000000000000000","started_at_unix_nanos":"0"}